Text,Language,target
ತಬ ಹದರತತದದ ನನನ ಪರಯನ ಚತಸಬಡ ಈ ಗಡ ಮತತದ ಪರಟಲ ಮಲಕ ಹಗ ಡರವಲ ತಲಪತ,Kannada,0
une autre façon de demander si vous navez pas saisi une partie dune phrase vous pouvez dire que je nai pas saisi le dernier mot,French,0
heeft ze denk ik dat ze nu geen goudbrood meer zou willen weet je,Dutch,0
dedos cruzados,Portugeese,0
 в 2018 году группа исследователей из сша швеции новой зеландии сингапура германии нидерландов и китая под руководством психолога б нозека англ,Russian,0
لتحديد إجماع المجتمع يمكن للمحررين إثارة المشكلات في منتديات المجتمع المناسبةnote 2 أو السعي للحصول على مدخلات خارجية من خلال طلب رأي ثالث أو عن طريق بدء مناقشة مجتمعية عامة تعرف باسم طلب التعليق,Arabic,0
ஒர கணம படததக களளஙகள,Tamil,0
katherine maher the nonprofit wikimedia foundations chief communications officer said the changes address a sentiment among volunteer editors that were not an advertising service were an encyclopedia,English,0
det betyder ikke noget om du vil ønske nogen held og lykke,Danish,0
ನವ ಯವಗಲ ಹರದಬಸಲ ಹಳಬಹದ,Kannada,0
 pero no solo se trata de ediciones dentro de artículo también existen artículos enteros falsos,Spanish,0
wie wäre es heute abend mit pizza zum abendessen,German,0
 several interactive multimedia encyclopedias incorporating entries written by the public existed long before wikipedia was founded,English,0
terry du siehst tatsächlich ein bisschen wie dieser engel aus aber was sehe ich wie könntest du er sein,German,0
okay lad os begynde,Danish,0
 a wikipédia pretende criar um resumo de todo o conhecimento humano na forma de uma enciclopédia online com cada tópico do conhecimento coberto enciclopedicamente por um artigo,Portugeese,0
എനതയല നനദ അത പരശനമലല എനതയല നനദ,Malayalam,0
questo è il miglior video con cui iniziare quindi andiamo a 50 frasi in inglese in 10 minuti si spera,Italian,1
sa politique de licence libre a obligé le monde juridique à prendre position sur les droits dauteur dœuvres créées par des nonhumains lors de la controverse du selfie du macaque,French,0
contrairement aux contributeurs anonymes les utilisateurs inscrits peuvent modifier les articles consulter leur liste de suivi ajouter et enlever des articles de cette liste etc,French,0
ora usiamo spesso la parola fantastico qui  è unaltra parola che puoi usare al posto di fantastico stupendo per esempio oggi ho ottenuto un punteggio stupendo nel mio test il che significa che ho ottenuto un punteggio molto alto o ho ottenuto un punteggio quasi perfetto la parola stupendo ha radici latine classiche dalla parola che significa,Italian,1
jeg har det godt,Danish,0
je vous ai confondu alors laissezmoi vous donner quelques exemples une situation catch22 est lorsque vous nobtenez pas un emploi sans avoir dexpérience de travail,French,0
വകകപഡയർകക പലസ കടതയ ഒര കടടറപപളള നയമസഹതയ ഇലല,Malayalam,0
depuis lantiquité le sujet des machines pensantes préoccupe les esprits,French,0
a página ver histórico que acompanha cada artigo regista toda e qualquer versão anterior do verbete embora uma revisão com conteúdo calunioso ameaças criminosas ou violações de direitos autorais possam ser removidas mais tarde,Portugeese,0
ನನ ಮಗಸಲ,Kannada,0
this was the first interactive multimedia encyclopedia and was also the first major multimedia document connected through internal links with the majority of articles being accessible through an interactive map of the uk,English,0
dautres initiatives sont aussi menées afin de développer une culture collaborative dans lenseignement,French,0
zo komt uit onderzoek van de wikimedia foundation naar enkele kenmerken van bewerkers van wikipedia naar voren dat de meerderheid van de bewerkers mannelijk is en geen partner en kinderen heeft,Dutch,0
frotté du ser faktiskt lite ut som den ängeln men vad ser jag hur kan du vara han ni är så trevliga,Sweedish,0
പല ഇഗലഷ പദങങൾകക തലയമയ മലയള പദമലലതതതനൽ ചലർ അവട അത പദ തനന മലയള ലപയൽ ഉപയഗകകനന,Malayalam,0
british artists john constable and j m w turner turned their attention to capturing the beauty of the natural world in their paintings,English,0
zou je me wat geld willen lenen,Dutch,0
 wikipedia contains materials that some people may find objectionable offensive or pornographic,English,0
ಸಭ ಅಥವ ದನಕವನನ ಹಳವ ಅತಯತ ಫರಚ ವಧನವದರ ಉದಹರಣಗ ನನ ಶನವರದದ lunch ಟದ ಸಮಯದಲಲ ನನನ ಸನಹತರದಗ ಸಧಸವಕಯನನ ಹದದದನ ಅಥವ ಸನಮಗಳಗಗ ಮಲನಲಲ ನನನ ಸನಹತರದಗ ಸಧಸಲ ನನ ಯಜಸತತದದನ ರಡಜವಸ ಚಲನಚತರಗಳನನ ನಮಪದವಗ ಅಥವ ಕರಯಪದವಗ ಬಳಸಬಹದ ಉದಹರಣಗ,Kannada,0
நன என நணபனப பரககறன,Tamil,0
cette époque a vu aussi se développer la philosophie du droit naturel dont découlent notamment les droits de lhomme et selon laquelle lhomme se verrait attribuer par nature des prérogatives immuables  mais ici le paradoxe nest quapparent car dans ce contexte la notion de nature est employée dans le sens de nature humaine et nimplique aucune espèce de  réconciliation  avec la nature la promotion des droits de lhomme est dailleurs jusquà présent indépendante de toute préoccupation environnementale,French,0
بين محرري ويكيبيديا غالبا ما يتم التعبير عن هذا على أنه إمكانية التحقق وليس الحقيقة للتعبير عن فكرة أن القراء وليس الموسوعة هم المسؤولون في النهاية عن التحقق من صحة المقالات وعمل تفسيراتهم الخاصة,Arabic,0
зверски иногда в тюрьмах слово зверство также используется в повседневной жизни чтобы говорить о какихто обычных проступках и вы хотите преувеличить,Russian,0
ಖಡತವಗಯ ಯವದ ತದರಯಲಲ,Kannada,0
θα το πάρω,Greek,0
إنه متوازن ولطيف للغاية خاصة أمام السيدات أو أن باراك أوباما لطيف للغاية ولطيف الآن تذكر عندما تكون في حفلة في المرة القادمة وترى هذا الشخص الذي هو كذلك,Arabic,0
തങങളട പരവർതതനങങളൽ ചലപപൾ അവർ തമമൽ ആശയസഘടടനങങൾ സഷടകകറണടങകല അവർ അത സമവയതതലട പരഹരകകനന,Malayalam,0
é uma maneira muito francesa de dizer encontro ou data por exemplo tenho um encontro com meus amigos durante o almoço no sábado ou estou planejando um encontro com meus amigos no shopping para filmes encontro pode ser usado como substantivo ou verbo por exemplo,Portugeese,0
suggestions,French,0
और फर आग बढ और समझए क आपक कह मल थ मन आपक सह कय,Hindi,0
ಮಹತಗಗ ಕಳವದ,Kannada,0
എഴതനന കരയങങൾകകലല തളവകൾ വണ എനനതകണട എലലവരകൾകക ഉറവട ചർതതകളളണ എനനലല,Malayalam,0
конечно что ты имеешь в виду,Russian,0
você pode dizer graças a deus é sextafeira ou pensar que céus disse descoberta de sábado fim de semana,Portugeese,0
 two of the recent projects of such internal research and development have been the creation of a visual editor and a largely underutilized thank tab which were developed to ameliorate issues of editor attrition which have met with limited success,English,0
هذه الأخيرة هي لغتا الفلبين,Arabic,0
así que la próxima vez que escuche sobre un acto horrible en las noticias recuerde hacerlo,Spanish,0
 في 20 كانون الثاني يناير 2014 أشارت تقارير سوبود فارما لصحيفة إيكونوميك تايمز إلى أنه لم يتوقف نمو ويكيبيديا فحسب بل فقد ما يقرب من عشرة بالمائة من مشاهدات صفحاتها العام الماضي,Arabic,0
another way to tell the person to not be upset is you can say things happen like its okay,English,0
velopdragen og kultiveret og sofistikeret,Danish,0
ನನನ ತಟಟಯಲಲ ತಬ ಇದ ನನ ಕಲಸದಲಲ ಮಳಗತತದದನ,Kannada,0
കയചച 22 എനന പദ ഉപയഗകകൻ,Malayalam,0
y ellos dicen que quiero comprar lo mismo y les digo que lo vendiste me vendiste yo no compraría esto bien me vendiste si no estás interesado en la conversación,Spanish,0
jai foiré,French,0
selflearning as a machine learning paradigm was introduced in 1982 along with a neural network capable of selflearning named crossbar adaptive array caa,English,0
è stato un piacere incontrarti dopo,Italian,1
det synker du siger træk dig sammen som at tage dig selv bogstaveligt talt og træk dig sammen stop med at arbejde stop med at græde træk dig sammen,Danish,0
está bien,Spanish,0
இத நலலத,Tamil,0
gli algoritmi genetici forniscono un approccio allapprendimento che è liberamente ispirato allevoluzione simulata,Italian,1
daarna werd dit aangepast tot een grijze versie op basis van hetzelfde idee,Dutch,0
terry du ser faktisk lidt ud som den engel men hvad ser jeg hvordan kunne du være ham i to er så flinke,Danish,0
 a wikipédia é um projeto de enciclopédia multilíngue de licença livre baseado na web e escrito de maneira colaborativa,Portugeese,0
yapmamanı tercih ederim,Turkish,0
ich habe es vermasselt,German,0
ಅದರ ಬಗಗ ಚತಸಬಡ,Kannada,0
اصبروا معي لحظة,Arabic,0
o que você fará esta noite,Portugeese,0
hai colpito il chiodo sulla testa,Italian,1
oh dumm er ist reich und gutaussehend,German,0
ಮಲ ಶಭಶಯಗಳ ಅದ ಹಗ ನಡಯತತದ,Kannada,0
amerikalıların kullandığı başka bir cümle de bunu açıklayan çok kötü ve,Turkish,0
wikipédia en français ouverte le 23 mars 2001 compte un peu plus de deux millions darticles la même année,French,0
inductive logic programming is particularly useful in bioinformatics and natural language processing,English,0
 se han producido varios casos en los que dirigentes políticos o personas próximas a ellos modificaron artículos de wikipedia interesadamente,Spanish,0
it was a pleasure meeting you see you later,English,0
ved hvis nogen fortæller en cool joke kan du fortælle at det er en god en,Danish,0
 se desarrolla en el sitio wikipediaorg haciendo uso de un software wiki término originalmente usado para el wikiwikiweb,Spanish,0
 wikipedia has also been used as a source in journalism often without attribution and several reporters have been dismissed for plagiarizing from wikipedia,English,0
 o nome wikipedia foi criado por larry sanger e é uma combinação de wiki uma tecnologia para criar sites colaborativos a partir da palavra havaiana wiki que significa rápido e enciclopédia,Portugeese,0
mon plaisir,French,0
les erreurs qui échappent à ces premiers niveaux de contrôle sont des erreurs peu évidentes ou qui portent sur des articles marginaux de faible avancement et peu surveillés,French,0
merci davance si quelquun a fait une erreur et il en est vraiment énervé,French,0
la voiture autonome présente un cadre test pour confronter lapprentissage automatique à la société,French,0
un millón de gracias,Spanish,0
ive lost my phone and im in a fix or our bus broke down this morning and im in a fix my friend always turns to me for help when hes in a fix and when the going is good he forgets about,English,0
lokalt anordnas ofta mindre och informella träffar på exempelvis något café eller pub,Sweedish,0
catch22 kelimesini kullanmak için,Turkish,0
en 2006 60  des  vandalismes  étaient détectés facilement par des humains modifications dénuées de sens offensantes ou encore suppressions massives mais certaines catégories de modifications semblaient plus délicates à repérer  désinformation suppression partielle spam et autres,French,0
wikipedia ha recibido diversas críticas,Spanish,0
elle illustre la diversité des thèmes étudiés en écologie et de façon plus générale dans les sciences naturelles,French,0
de situatie is dat je iets niet hebt gekregen en dan krijg je een extra effect en je krijgt het,Dutch,0
la proposta specifica di turing anticipa gli algoritmi genetici,Italian,1
നങങൾ അതനകകറചച കരയനന പരശനതതകകൾ വളര മകചചതണ നങങൾ  നങങളട കണണനരന വലയലല,Malayalam,0
det var en meget egoistisk drømmemor du ved ikke hvad du siger at drømmen har fået mig til at indse at jeg har brug for mad meget større end den type jeg spiser her hjemme brød lavet af guld,Danish,0
யரவத உஙகளடம ஏதவத கடடல எனனல கறவகக கவனகக மடயவலல இத எனத 1 மலலயன டலரகள எடததக களளஙகள எனற யரவத சலவத பல இத உஙகளகக மகவம எளதன மடவ,Tamil,0
in april 2009 wikipedia and its sister projects held a communitywide referendum which decided the switch in june 2009,English,0
 تمت الإشارة إلى تفضيل المشروع للتماسك حتى لو كان يتطلب حل وسط يتضمن تجاهل أوراق الاعتماد على أنه  معاداة النخبوية ,Arabic,0
कस आज रत क खन क लए पजज क बर म,Hindi,0
properties common to terrestrial organisms plants animals fungi protists archaea and bacteria are that they are cellular carbonandwaterbased with complex organization having a metabolism a capacity to grow respond to stimuli and reproduce,English,0
publicerar man inte under fri licens krävs att man kommer överens med upphovspersonerna exempelvis med en fotograf om ersättning,Sweedish,0
el número tres es afable afable afable significa ser sofisticado para ser educado sereno fresco y bien educado la palabra suave tiene varios orígenes diferentes pero un origen muy interesante de la palabra es que significa ejemplo de sabor agradable o dulce,Spanish,0
a estrutura aberta da wikipédia faz com que ela seja um alvo fácil para os trolls spams e aqueles procuram usar o projeto para espalhar suas ideias,Portugeese,0
 debido a su considerable popularidad existieron propuestas de mascotas que representaban a wikipedia de una manera no oficial,Spanish,0
the original release cover caused controversy and was replaced in some countries,English,0
കഷമ ചദകകനന,Malayalam,0
എനകകറയലല എനന പറഞഞ,Malayalam,0
tak på forhånd hvilket betyder at jeg virkelig håber at du skal,Danish,0
பமம மறறம மகவம வடககயன பகத அவள தனன நசததள நரசச நஙகள வரமபவதலல,Tamil,0
θα ήθελα να κάνω κάτι αλλά δεν μπορώ,Greek,0
ik was bang dat dit super boos is,Dutch,0
είμαι ο άγγελος της καλής τύχης το όνομα και η ομορφιά της κόρης σας είναι γνωστό σε όλο τον κόσμο εδώ σας έφερα ένα δώρο αλλά σχεδόν δεν τον γνωρίζετε ότι δεν μπορείτε να πάτε μαζί του,Greek,0
om du vill tacka någon kan du säga att det är väldigt snällt av dig tack så mycket för att du gör det som är väldigt snällt av dig det är väldigt snällt av dig om någon,Sweedish,0
അതനൽ വകകപഡയയല ഉളളടകക എലലകകലവ സവതനതരവ സജനയവ ആയരകക,Malayalam,0
 a working group led by peter stone formed as a part of the stanfordbased project one hundred year study on artificial intelligence in its report called wikipedia the bestknown example of crowdsourcing  that far exceeds traditionallycompiled information sources such as encyclopedias and dictionaries in scale and depth,English,0
скрещенные пальцы,Russian,0
there is also some gas plasma and dust and small meteors,English,0
അവൻ തമമമപൾ ഓ അവസന സററപപ ഇലല എനകക ഇന കൾകകൻ തൽപപരയമലല എനകക കണൻ കഴഞഞത ആ പരഷനമർ ശരകക നലലവരയരനന എനറ പരയ ആ സനദരയ നങങൾ അറഞഞരകകണ,Malayalam,0
ಓ ದವರ,Kannada,0
 the term machine learning was coined in 1959 by arthur samuel an american ibmer and pioneer in the field of computer gaming and artificial intelligence,English,0
 wales cita el ensayo el uso del conocimiento en la sociedad escrito por el economista y filósofo de la escuela austriaca y premio nobel de economía friedrich hayek que leyó cuando era estudiante como central para su pensamiento acerca de cómo gestionar el proyecto wikipedia hayek argumenta que la información está descentralizada cada individuo solo conoce una pequeña fracción de lo que se conoce colectivamente y como resultado las decisiones se toman mejor por aquellos con conocimientos locales en lugar de por una autoridad central,Spanish,0
wikipedia ha ricevuto plausi da fonti giornalistiche quali bbc news usa today the economist newsweek businessweek il chicago suntimes time magazine e wired magazinesenza fonte,Italian,1
sonra görüşürüz,Turkish,0
και πάρτε αυτές τις θαυμαστικές εμφανίσεις από τους φίλους σας άλλες λέξεις που μπορείτε να χρησιμοποιήσετε στη θέση του catch22 είναι παράδοξη ή έξυπνη λέξη για το δίλημμα,Greek,0
tree models where the target variable can take a discrete set of values are called classification trees in these tree structures leaves represent class labels and branches represent conjunctions of features that lead to those class labels,English,0
las cifras que son referenciadas respectivamente a cada versión son actuales,Spanish,0
ನವ ಏನನನದರ ಹಡಯದದದರ ಅಥವ ನವ ಯವಗಲ ಕಳಬಹದದ ವಯಕತಯನನ ನನ ಅರಥಮಡಕಳಳದದದರ ಏನ ನಡಯತತದ,Kannada,0
association rule learning is a rulebased machine learning method for discovering relationships between variables in large databases,English,0
അത ദയവയ,Malayalam,0
average oceanic salinity is around 35 parts per thousand ppt 35 and nearly all seawater has a salinity in the range of 30 to 38 ppt,English,0
during the advent of modern scientific method in the last several centuries nature became the passive reality organized and moved by divine laws,English,0
a maggio 2017 sono presenti 296 diverse edizioni linguistiche di wikipedia di cui 285 attive,Italian,1
je kunt gewoon geen zorgen zeggen,Dutch,0
أنا مرعوب من ملاك الحظ السعيد اسم ابنتك وجمالها معروف في جميع أنحاء العالم هنا لقد أحضرت لك هدية ولكنك بالكاد تعرفه لا يمكنك الذهاب معه,Arabic,0
tali collegamenti tuttavia sono proposti al lettore solo come letture supplementari e non come fonti usate dallautore dellarticolo e le enhanced perspectives non sono pensate per servire esse stesse da materiale di riferimento,Italian,1
el aprendizaje automático las personas lo llevamos a cabo de manera automática ya que es un proceso tan sencillo para nosotros que ni nos damos cuenta de cómo se realiza y todo lo que implica,Spanish,0
ik geef je die geheime tip om heel vloeiend te klinken,Dutch,0
ces entrées présidentielles sont déjà modifiées disséquées et débattues de nombreuses fois chaque jour,French,0
two notable examples of salt lakes are the aral sea and the great salt lake,English,0
إنها تغرق وتقول إنها تجمع بين نفسك مثل خذ نفسك حرفيا واجمع نفسك معا  توقف عن العمل  توقف عن البكاء  اجمع نفسك معا,Arabic,0
dai,Italian,1
ancak thriller dünyanın gelmiş geçmiş en çok satan albümüdür ifadesi bir olgudur ve güvenilir üçüncü parti kaynaklarını göstermek kaydı ile vikipedide yer alabilir,Turkish,0
ik vroeg me af of je me hiermee kon helpen,Dutch,0
in questo caso la neutralità e le reciproche obiezioni spingono verso il minimo comun denominatore e bisogna accontentarsi,Italian,1
δεν με ενδιαφέρει,Greek,0
പതവല അലപ കഷണവ കറവമളളതയ കണൻ,Malayalam,0
kom op,Dutch,0
its like it doesnt matter,English,0
το βάλτο είναι ένα κομμάτι υγρότοπου και εάν κάποιος πατήσει σε λάθος μέρος σε ένα βάλτο θα μπορούσε εύκολα να πνιγεί και η ρήμα μορφή του βάλτου σημαίνει να βυθιστεί έτσι μπορείτε να χρησιμοποιήσετε αυτήν τη λέξη,Greek,0
je peux toujours dire ça parce que je navais pas t très bien préparé pour lexamen jai été décontenancé par certaines des questions dautres mots que vous pouvez utiliser au lieu de déconcertés sont déconcertés perplexes ou perplexes le mot intelligent numéro huit est le rendezvous rendezvous rendezvous,French,0
மகழசசயன கறறல மறறம வரவல மறறர படததல உஙகளப பரபபன,Tamil,0
nummer drei ist höflich höflich höflich bedeutet raffiniert zu sein höflich und cool zu sein,German,0
πως ξέρεις,Greek,0
 a wikipédia foi formalmente lançada em 15 de janeiro de 2001 como uma única edição em inglês em wwwwikipediacom e anunciada por sanger na lista de discussão da nupedia,Portugeese,0
det spelar ingen roll som oroa dig inte om du tappar ditt kaffe över mig,Sweedish,0
birine teşekkür etmek istiyorsanız çok naziksiniz diyebilirsiniz bunu yaptığınız için çok teşekkür ederim bu çok naziksiniz eğer birisi iseniz çok naziksiniz,Turkish,0
ഞൻ നങങള പനനട കണ,Malayalam,0
o conteúdo da wikipédia é publicado fora do site wikipédia em muitas formas tanto online como offline,Portugeese,0
തങങൾ ചയയനനത വകകപഡയകക നലകനനതമയ എനത മററ വകകപഡയർകക വകകപഡയയട വയനകകർകക സവതനതരമയ ഉപയഗകകനളള അനവദ വകകപഡയർ നലകയരകകനന,Malayalam,0
aux étatsunis il existe la tendance à juger une technologie par la qualité du résultat quelle produit alors quen europe le principe de précaution est appliqué et on y a plus tendance à juger une nouvelle technologie par rapport aux précédentes en évaluant les différences par rapport à ce qui est déjà connu,French,0
en 2019 lespèce viola wikipedia est nommée en lhonneur de lencyclopédie,French,0
cómo estás,Spanish,0
lobiettivo principe dellapprendimento automatico è che una macchina sia in grado di generalizzare dalla propria esperienza ossia che sia in grado di svolgere ragionamenti induttivi,Italian,1
me golpea,Spanish,0
sökmotorer som google leder ofta till wikipedia och driver webbtrafik till wikipedia,Sweedish,0
grazie in anticipo il che significa che spero davvero che lo farai,Italian,1
يجب ألا يقدم بحثا أصليا,Arabic,0
 wikipedia er blevet kritiseret for at udvise systematisk bias for at fremstille en blanding af sandheder halve sandheder og nogle løgne og for at være genstand for manipulation og spin i forbindelse med kontroversielle emner,Danish,0
stört es dich wenn ich hier rein springe,German,0
θα ήταν υπέροχο υπάρχει ένα κόκκινο κουμπί εκεί κάπου,Greek,0
situationen är att du inte fick något och sedan får du en extra effekt och du får det,Sweedish,0
ಅದನನ ಉಲಲಖಸಬಡ,Kannada,0
los algoritmos genéticos son procesos de búsqueda heurística que simulan la selección natural,Spanish,0
le projet wikipédia a aussi influencé la création dune encyclopédie dextrême droite qui se dit  encyclopédie alternative  metapedia créée le 26 octobre 2006 en suédois puis son pendant slave wikislavia,French,0
zinnen als je al een tijdje engels leert en je wilt hervatten,Dutch,0
ഇതവര കണതത ദതതവവര മതകയൽപപല നടപപലകകമനന സവശഷതയണ സമനയവതകരണ ഇത സധയമകകനന അവസഥകള കണകകകടടൽ പഠന സദധനത ശഖയട ആണകകലലയ കണകകകക,Malayalam,0
 det er rangeret som verdens mest citerede videnskabelige tidsskrift af science edition i 2010udgaven journal citation reports og har en ifaktor på 40137 hvilket gør det til verdens mest citerede akademiske magasin,Danish,0
det var länge sedan,Sweedish,0
நட நடகளக பரகக வலல,Tamil,0
je serai bien avec toi,French,0
ತದನತರ ಮದವರಯರ ಮತತ ನವ ಎಲಲಗ ಬದದದರ ಎದ ವವರಸ ನನ ನಮಮನನ ಸರಯಗ ಪಡದಕಡ,Kannada,0
