Text,Language,target
إنها في الواقع الساعة 1 9 مساء,Arabic,0
 os cientistas da pesquisa são o público principal da revista mas resumos e artigos de acompanhamento destinamse a fazer muitos dos estudos importantes mais compreensíveis para cientistas de outras áreas e para o público educado,Portugeese,0
jeg kunne ikke være mere enig,Danish,0
 ndesanjo macha indica que muchas veces lo más enriquecedor está en las discusiones y no en el artículo propiamente dicho porque allí pueden reflejarse mejor los distintos puntos de vista y las lagunas existentes,Spanish,0
aman tanrım,Turkish,0
dus vandaag gaan we 10 nieuwe slimme woorden leren hun betekenis wortelwoorden en voorbeeldzinnen dus laten we aan de slag gaan hey dit is allemaal en jullie kijken,Dutch,0
пользователи википедии  это участники википедии образуют сообщество участников википедии,Russian,0
certains comptes utilisateurs sont utilisés par des logiciels dits  robots  ou  bots  programmés pour assurer la maintenance des articles par exemple pour corriger des erreurs communes dorthographe ou de mise en forme lutter contre les vandalismes ou encore dans certaines éditions de wikipédia créer de nombreux nouveaux articles,French,0
இலல மனனககவம நன ஏறகனவ சல தடடஙகள வறததனமக வததரககறன,Tamil,0
ഇഗലഷ വകകപഡയയൽ പലപപഴ ഭരപകഷ ആളകളട അഭപരയ സതയ എനന രപതതൽ അടചചൽപപകകൻ സദധയതയണടവറണട ഉദഹരണതതന കശമർ പരശന  ഇതൽ പകസതൻ വശജരകകള കടതൽ വകകപഡയ ഉപയകതകകൾ ഇനതയയൽ നനന ഉളളവരയതനൽ ലഖനതതന ഇനതയ അനകല ചയവ വരൻ സദധയതയണട,Malayalam,0
persino le cancellazioni e gli altri vandalismi che una pagina subisce sono di norma visibili a tutti,Italian,1
basisgroeten hoe gaat het,Dutch,0
risken att den artikelversion man läser innehåller klotter beräknades till cirka 0004 procent,Sweedish,0
hvis du ikke allerede har trykket på abonnementsknappen og klokkeikonet lige ved siden af det og glæde at se,Danish,0
they include bacteria fungi archaea and protista,English,0
dont worry about it,English,0
أنا مشغول نوعا ما غدا,Arabic,0
σε ευχαριστώ για την προσπάθεια σου,Greek,0
affonda dici riprenditi come letteralmente prendi te stesso e rimettiti insieme smetti di lavorare smetti di piangere tirati su hey calmati insieme unaltra frase che,Italian,1
ಅದ ಬಳಗದ ಅದರ ಕಯಲಫರನಯದಲಲ ಅನಕ ಅಮರಕನನರ ಹಳದದ ಅದಭತವಗದ,Kannada,0
يقوم الاستقرائي باستنتاج قواعد وأحكام عامة من البيانات الضخمة,Arabic,0
 nota no debe confundirse wikipedia con la fundación wikimedia la organización no gubernamental que mantiene al sitio web wikipedia,Spanish,0
6113330 ൽ അധക  ലഖനങങളളള ഇഗലഷ പതപപണ httpenwikipediaorg ഈ സരഭതതനറ പതകവഹക,Malayalam,0
weve learnt a whole lot of these smart words and we tend to stuff two three four of them in one sentence that doesnt sound natural,English,0
warum verwenden sie stattdessen nicht flummox,German,0
lintérieur reste actif avec une épaisse couche de manteau en convection et un noyau rempli de fer qui génère un champ magnétique,French,0
 in 2010 the wall street journal wrote about the firm rebellion research and their use of machine learning to predict the financial crisis,English,0
إن مختلف صلاحيات إداريي الويكي تمكنهم من حماية المقالات التي تحتاج مراقبة مكثفة أو تتعرض لتخريب متنوع كمقالات البلدان مثلا أو المقالات عن المواضيع الدينية والسياسية,Arabic,0
 para la fundación la privacidad de la información es tan importante como la prevención de vandalismo,Spanish,0
çiviyi kafasına vur,Turkish,0
el aprendizaje automático tiene una amplia gama de aplicaciones incluyendo motores de búsqueda diagnósticos médicos detección de fraude en el uso de tarjetas de crédito análisis del mercado de valores clasificación de secuencias de adn reconocimiento del habla y del lenguaje escrito juegos y robótica,Spanish,0
le 20 juin 2003 la wikimedia foundation est créée pour financer le soutien technique de wikipédia,French,0
bacterial life is sometimes included in flora and some classifications use the term bacterial flora separately from plant flora,English,0
ನವ ನನನನನ ಆವರಸಬಹದ ಹರಡವ ಸಮಯ ಮತತ ಹಡಗರಗ ನನ ಹಗವದ ಉತತಮ ಅದರ ನನ ಈಗಗಲ ಹಗಬಕ,Kannada,0
metapedia existe en suédois en anglais en hongrois en espagnol en français en slovaque en portugais en tchèque en roumain en allemand en estonien en norvégien en croate en danois en néerlandais et en grec,French,0
പകഷ ഇനതയൻ ഭഷകളല ആദയതത വകകപഡയകളയ ഇവ മനന ഇപപൾ നർജവമണ,Malayalam,0
de comptons interactive encyclopedia van philips cdi 1992 en encarta 1993 van microsoft waren de eerste encyclopedieën op cdrom die gebruikmaakten van hyperlinks,Dutch,0
noubliez pas de dire hé qui est ce gars suave juste làbas dans le coin en utilisant ce mot fera instantanément votre vocabulaire,French,0
nogen har travlt kan du altid sige undskyld at genere dig og så kan du gå videre og spørge,Danish,0
болото  это кусок заболоченного места и если ктото ступит на болото не в том месте он может легко утонуть а глагольная форма болота означает тонуть поэтому вот как вы можете использовать это слово,Russian,0
википроекты фонда викимедиа самым крупным из которых является википедия по состоянию на март 2013 года поддерживались работой нескольких кластеров состоящих из 974 серверов,Russian,0
instead probabilistic bounds on the performance are quite common,English,0
இதன பரள அநத நபர மணடம மணடம சயயத தணடகறத,Tamil,0
ze zou die dag haar leven leiden,Dutch,0
 en total la comunidad está conformada por más de 400 millones de usuarios registrados en todo el mundo incluyendo algo más de 1 700 000 en la versión hispana donde el 13  son mujeres,Spanish,0
no se preocupe no se preocupe lo que significa que no se preocupe,Spanish,0
وقت طويل لا رؤية,Arabic,0
det gøres af forvaltere stewards,Danish,0
qué tal un helado,Spanish,0
in unsupervised feature learning features are learned with unlabeled input data,English,0
 the wall street journal reported on may 1 2014 that tretikovs information technology background from her years at university of california offers wikipedia an opportunity to develop in more concentrated directions guided by her often repeated position statement that information like air wants to be free,English,0
71  de la surface de la terre est recouverte docéans deau salée,French,0
je suis vraiment désolé pour ça,French,0
φράσεις εάν μαθαίνετε αγγλικά για λίγο και θέλετε να συνεχίσετε να μαθαίνετε,Greek,0
ज बलय यह बहत अचछ हग धनयवद म ठक ह लकन पशकश क लए धनयवद नह म अचछ ह धनयवद लग क धनयवद बहत  बहत धनयवद चयरस म वसतव म इसक सरहन करत ह आप बहत दयल ह म आपक परयपत धनयवद नह द सकत यह कछ भ नह ह इसक उललख न कर कस भ समय मर सभगय कस क इतजर करन क लए कहन कय आप समय पर पकड सकत ह कपय,Hindi,0
 a wikipédia também tem sido utilizada como fonte no jornalismo muitas vezes sem atribuição sendo que vários jornalistas foram demitidos por plagiar a wikipédia,Portugeese,0
och de är som att jag vill köpa samma sak och jag säger till dem att du sålde det att du sålde mig jag skulle inte köpa det här du sålde mig om du inte är intresserad av konversationen,Sweedish,0
faitesle en vous remerciant davance,French,0
சர பதவன வககயஙகள மறறம சறறடரகளப பறறய கடதல படபபனகள நஙகள வரமபனல கழயளள கரததகள பரவல எனககத தரயபபடததஙகள,Tamil,0
do you mind if i jump in here,English,0
υπέροχα ευχαριστώ,Greek,0
sei nel bel mezzo di qualcosa e qualcuno qualcuno ti sta chiedendo di fare qualcosa che dici mi dispiace,Italian,1
 the latest version of the android app for wikipedia was released on july 23 2014 to generally positive reviews scoring over four of a possible five in a poll of approximately 200000 users downloading from google,English,0
ಹಗ  ನರಸಸಸಮ ಈಗ ಮರಯನ ಅವರಗ ಸಭವಸದ ಎಲಲವನನ ಹಳದ ಮತತ ಅವಳ ಆ ಸಮಯದದ ತಬ ಬದಲಗದದಳ,Kannada,0
он был красив он вообще не заботился обо мне но моя дорогая ты понимаешь что именно так ты относился к другим я знаю мне очень жаль как я вела себя мама о нет все в порядке раз ты видела,Russian,0
i studien wikipedians are born not made a study of power editors on wikipedia från 2009 bekräftar katherine panciera mfl,Sweedish,0
det här är en nobrainer betyder att det är ett riktigt enkelt beslut för dig om du har gjort något fel och du erkänner att du kan säga att jag har skruvat upp ja killar,Sweedish,0
 इस सइटन मडय क कई रप पर एक परभव पद कय ह कछ मडय सरत तरटय क लए वकपडय क सवदनशलत पर वयगय करत ह जस जलई 2006 म द अनयन म मख पषठ क लख जसक शरषक थ वकपडय सलबरटस 750 इयरस ऑफ अमरकन इडपनडस,Hindi,0
οι συντάκτες ενθαρρύνονται να τηρούν μια πολιτική ουδετερότητας κάτω από την οποία οι διάφορες απόψεις συγκεντρώνονται χωρίς να γίνεται προσπάθεια να καθοριστεί μια αντικειμενική αλήθεια,Greek,0
переводные статьи представляют лишь небольшую долю статей в большинстве разделов в частности потому что автоматизированный перевод статей не разрешён,Russian,0
não se esqueça de dizer ei quem é aquele cara gentil aí fora no canto usando essa palavra vai fazer seu vocabulário instantaneamente,Portugeese,0
mchenry har också framfört att wikipedia faller på att den säger sig vara en encyklopedi ett ord som inger en auktoritet och pålitlighet som är oförenligt med koncepten öppenhet och wiki,Sweedish,0
μπορώ να πω φροντίστε που σημαίνει να φροντίζετε τον εαυτό σας,Greek,0
обычный,Russian,0
te importaría repetir eso,Spanish,0
la wikipedia en español creada meses después heredó el nombre,Spanish,0
я потерял телефон и я в затруднительном положении или наш автобус сломался этим утром и я в затруднительном положении мой друг всегда обращается ко мне за помощью когда он в затруднительном положении а когда дела идут хорошо он забывает о нем,Russian,0
når du hører en sætning øve sig efter mig,Danish,0
ja vær venlig at gå videre,Danish,0
നങങൾ റകക യ റകക,Malayalam,0
willst du dieses wochenende etwas unternehmen,German,0
ഒരപകഷ നങങൾ ഫണൽ സസരചചരകക ആര നങങളട സസരകകനനണടക നങങൾ അങങനയയരകക,Malayalam,0
fallo un po ringraziandoti in anticipo,Italian,1
opinions,English,0
lenciclopedia partecipata mi preoccupa meno la uso regolarmente e trovo che la qualità e laffidabilità delle informazioni sia notevole,Italian,1
ಚನನದ ಗಡ ಅವರಗ ಸವರ ಮಡಲ ಬದತ ಅದ ರತನಗಳ ಮತತ ವಜರಗಳದ ಕಡದ ಮತತ ಅತಯತ ಬರಗಗಳಸತತದ,Kannada,0
um controle especial registra automaticamente a data e hora de cada última atualização,Portugeese,0
la turquie bloque laccès à wikipédia le 29 avril 2017 en raison de la présence darticles évoquant la possible collaboration entre le gouvernement turc et des organisations jihadistes actives en syrie,French,0
 a wikipédia tem trabalhado na mudança para as licenças creative commons porque a gfdl inicialmente projetada para manuais de software não foi considerada adequada para obras de referência online e porque as duas licenças eram incompatíveis,Portugeese,0
den første mobile udgave formateret til wap wapediamobi har eksisteret siden 2004  og siden 2009 til andre mobile enheder inkl,Danish,0
por favor procure por machine learning na wikipédia para buscar por títulos alternativos,Portugeese,0
obtaining the full contents of wikipedia for reuse presents challenges since direct cloning via a web crawler is discouraged,English,0
பரமபலம இதன எலலக கடடரகளம இதனப பயனபடததம எவரலம தகககபபடக கடவன,Tamil,0
ist eine sehr französische art zu sagen treffen oder datum zum beispiel ich habe ein rendezvous mit meinen freunden beim mittagessen am samstag oder ich plane ein rendezvous mit meinen freunden im einkaufszentrum für filme rendezvous kann sowohl als substantiv als auch als verb verwendet werden beispielsweise,German,0
er zijn ook enkele wikipedias opgestart in minderheidstalen dialecten en inmiddels uitgestorven talen zoals het latijn en oudengels,Dutch,0
വകകഎഴതനനതലല പർഫകററവണ എനന വശ ആർകക വണട പറക വരനനവർ തരതതകകള അലലങകൽ കടടചചർതതള എനന അവബധ വകകയൽ എഴതനന സധരണ ഉപയകതകകൾകക വലയരതമവശവസ നൽകനനണട,Malayalam,0
wikipedia possiede una comunità di utenti che sono in proporzione pochi ma molto attivi,Italian,1
os temas dos artigos devem também atender aos padrões de notoriedade da wikipédia o que normalmente significa que ele deve ter recebido uma cobertura significativa em fontes secundárias confiáveis tais como a mídia ou grandes revistas acadêmicas que são independentes do assunto do tópico,Portugeese,0
 wikipedians often have disputes regarding content which may result in repeatedly making opposite changes to an article known as edit warring,English,0
ಹಗ ನಡಯತತದ,Kannada,0
lensemble des prix décernés à wikipédia peut être vu sur wikipédiameta sur la page trophy shelf,French,0
herregud,Sweedish,0
arthur samuel che coniò il termine nel 1959 in linea di principio identifica due approcci distinti,Italian,1
you hit the nail on the head,English,0
 altri progetti lapprendimento automatico nella letteratura di lingua anglosassone machine learning è una branca dellintelligenza artificiale che raccoglie metodi sviluppati negli ultimi decenni del xx secolo in varie comunità scientifiche sotto diversi nomi quali statistica computazionale riconoscimento di pattern reti neurali artificiali filtraggio adattivo teoria dei sistemi dinamici elaborazione delle immagini data mining algoritmi adattivi ecc che utilizza metodi statistici per migliorare la performance di un algoritmo nellidentificare pattern nei dati,Italian,1
 العملية عبارة عن سيناريو مستهلك للموارد حيث لا يتم إضافة معرفة مفيدة,Arabic,0
tänk bara på att den stackars narcissemamma var så orolig för sin dotter och hur,Sweedish,0
poupée et la partie la plus amusante est quelle saimait sans fin narcisa vous,French,0
в разных странах созданы региональные организации т н,Russian,0
பனனர வவவற மழகளல வககபபடய உரவககபபடட 2001 ஆம ஆணடன மடவல கடடததடட 20000 கடடரகளடன 18 மழகளல வளரநதத,Tamil,0
des hyperliens externes mènent aux sources dinformation en ligne venant à lappui de larticlep,French,0
tjek stavningen eller se om den dukker op senere inden du forsøger at oprette artiklen igen,Danish,0
تمول ويكيبيديا بواسطة مؤسسة ويكيميديا في الربع الرابع من سنة 2005 تم صرف 321000 دولار أمريكي على ويكيبيديا 60 من المصروفات كانت على المكونات المادية,Arabic,0
எனன மனனககவம,Tamil,0
 the total number of species is in rapid decline,English,0
நன ஒபபககளகறன எனற எனககத தரயவலல,Tamil,0
но была убита горем изза всего что было несъедобным она вскоре начала плакать я не хочу этого но еда действительно хорошая,Russian,0
it shifted focus away from the symbolic approaches it had inherited from ai and toward methods and models borrowed from statistics and probability theory,English,0
men var hjärtskadad för allt det var oätligt hon började snart gråta jag vill inte ha det här men maten är riktigt bra,Sweedish,0
സധരണ വകകപഡയരയ സസപപകളയ അപകഷചച ജലഭര കടയ ഉപവഭഗമണ ബയറകരററകൾ,Malayalam,0
расположена по адресу wikipediaorg,Russian,0
no entanto o conteúdo da wikipédia está agora também acessível através da web móvel,Portugeese,0
 det finns ämnesorienterade wikipediasidor som exemplifierar hur wikipedia kan användas av släktforskare av lärare och av vandrare,Sweedish,0
wikipédia écouter est une encyclopédie universelle et multilingue créée par jimmy wales et larry sanger le 15 janvier 2001,French,0
oh je eines nachts als sie schlief saß ihre mutter an ihrer seite und beobachtete sie,German,0
haciendo peticiones,Spanish,0
 wikipédia reçoit le prix princesse des asturies de la coopération internationale en juin 2015,French,0
et tu es comme oh ça lexplique qui lexplique,French,0
william g emigh e susan c herring 2005 affermano che pochi utenti attivi quando agiscono in concerto con norme stabilite allinterno di un sistema redazionale aperto possono raggiungere il controllo totale sul contenuto prodotto nel sistema cancellando letteralmente diversità controversie e inconsistenze e omogeneizzando le voci dei collaboratori i redattori di wikinfo un progetto derivato da wikipedia sostengono analogamente che i contributori nuovi o controversi di wikipedia sono spesso ingiustamente etichettati troll o utenti problematici e viene loro impedito di apportare modifiche,Italian,1
haciendo planes,Spanish,0
ಯರದರ ತಪಪ ಮಡದರ ಮಚತವಗ ಧನಯವದಗಳ ಮತತ ಅವನ ಅದರ ಬಗಗ ನಜವಗಯ ಅಸಮಧನ ಹದದದನ,Kannada,0
dans le cas le plus général sans étiquette on cherche à déterminer la structure sousjacente des données qui peuvent être une densité de probabilité et il sagit alors dapprentissage non supervisé,French,0
experimente aqui algumas batatas douradas elas são muito boas e depois que você se casar comigo,Portugeese,0
нупедия первоначально лицензированная в соответствии со своей лицензией nupedia open content license перешла на gnu free documentation license перед основанием википедии по настоянию ричарда столлмана,Russian,0
ഇത പരവർതതകകമനന ഞൻ സതയസനധമയ കരതനനലല,Malayalam,0
il ny a pas de place pour le doute en amérique si vous voulez envoyer un sms à quelquun ou lui envoyer un message que vous dites texte à texte donc je vais vous envoyer un sms signifie que je vous enverrai un message via whatsapp ou un télégramme ou un messager de tout ce qui utilise je vais envoyezvous à nouveau un texto pour remonter le moral de quelquun pour lui dire de ne pas être contrarié vous pouvez dire que ça ne vaut pas la peine ça ne vaut pas le coup,French,0
hej fyre velkommen til min kanal i denne video,Danish,0
policyer policies och riktlinjer guidelines underlättar ofta konfliktlösning men forskarna har hittat flera exempel där fundamentalt olika tolkningar av policyer inte har lett till någon lösning utan tvärtom förhindrat konsensus,Sweedish,0
ve benimle evlenmek istediğini altın bir vagonla geldiğini ve tepeden tırnağa altın giyinmiş olduğunu ve ne aptalca bir rüya olduğunu söyledi,Turkish,0
ζητώντας από κάποιον να περιμένει,Greek,0
لدي موعد مع أصدقائي هذا المساء أو سألتقي مع أصدقائي غدا,Arabic,0
its not worth it i personally love the phrase you rock which means youre amazing,English,0
 featuring no advertisements it is hosted by the wikimedia foundation an american nonprofit organization funded primarily through donations,English,0
όταν φταρνίστηκε ω και η τελευταία στάση όχι δεν θέλω να ακούσω πια το μόνο που μπορούσα να δω ήταν ότι αυτοί οι άντρες ήταν πολύ καλοί αγαπητέ μου πρέπει να ξέρετε αυτή την ομορφιά,Greek,0
शष क लए वशष भष स समबधत लख क लए अनय ससकरण म समककष न हन दरलभ नह ह उदहरण क लए सयकत रजय अमरक म छट शहर क बर म लख कवल अगरज म ह उपलबध ह सकत ह अनवदत लख अधकश ससकरण म लख क एक छट हसस क परतनधतव करत ह कयक लख क सवचलत अनवद क अनमत नह हत ह   एक स अधक भष म उपलबध लख इटरवक लक पश कर सकत ह ज अनय ससकरण क समककष लख स समबधत हत ह वकपडय लख क सगरह ऑपटकल डसकस पर परकशत कय गय ह एक अगरज ससकरण 2006 वकपडय cd सलकशन म लगभग 2000 लख शमल थ पलश ससकरण म लगभग 240000 लख शमल ह जरमन ससकरण भ उपलबध ह अपन लख क सखय म तरकक वकस क अलव 2001 म अपन सथपन क बद स वकपडय न एक आम सनदरभ वबसइट क रप म दरज परपत कय ह अलकस और कमसकर क अनसर दनय भर म वकपडय उन अगरण दस वबसईट म ह जस पर लग सबस जयद जत ह शरष दस म स वकपडय ह एकमतर गर लभ वबसइट ह गगल खज परणम म इसक परमख सथन दवर वकपडय क वकस क परतसहत कय गय ह वकपडय म आन वल सरच इजन टरफक क लगभग 50 गगल स आत ह जसम स एक बड भग अकदमक अनसधन स सबधत ह अपरल 2007 म पय इनटरनट और अमरकन लइफ परयजन न यह पय क एक तहई अमरक इटरनट उपयगकरत वकपडय स सलह लत ह अकटबर 2006 म सइट क एक कलपनक खपत मलय अनमनत  580 मलयन थ अगर सईट न वजञपन चलय,Hindi,0
här listas några exempel  svenskspråkiga wikipedia har ännu inte någon sida med namnet machine learning andra orsaker till varför detta meddelande visas  vi letar alla efter snabba sätt att bli mer flytande på engelska jag vet att jag förstår vad som händer är att det bara finns några ord som kretsar kring vår hjärna och vi måste göra hela konversationen med bara fantastiskt fantastiskt coolt eller episkt så vad sägs om oss lära dig några smarta nya engelska ord som du kan använda i ditt dagliga liv och höja ditt ordförråd på några minuter,Sweedish,0
في مثال الطاقة  وجبة غداء ثقيلة تجعلني في فترة ما بعد الظهيرة بطيئا لها جذور من الكلمة التي تعني شخصا بطيئا  والسلج هو حيوان يتحرك ببطء شديد مثل أمثلة الحلزون,Arabic,0
