Text,Language,target
med andra ord gör tekniken det möjligt att nå tidigare outnyttjade resurser genom att tröskeln för att delta sänkts,Sweedish,0
lov,Sweedish,0
os capítulos wikimedia associações locais de usuários e defensores dos projetos wikimedia participam também da promoção desenvolvimento e financiamento do projeto,Portugeese,0
når som helst,Danish,0
итак сегодня мы собираемся выучить 10 новых умных слов их значения корневые слова и примеры предложений так что давайте приступим привет всем и вы смотрите,Russian,0
entre otras cosas afirmaba que el estudio de nature fue poco estricto y sesgado así como que según su propio estudio la britannica continuaba siendo un 24  más fiable que la wikipedia,Spanish,0
i have a rendezvous with my friends this evening or im going to rendezvous with my friends tomorrow,English,0
dat is verlicht wat betekent dat dat verbazingwekkend is zeiden veel amerikanen in californië,Dutch,0
 சலவளகளல இதறகக வககடபபம நடததபபடம,Tamil,0
tabağımda çok fazla şey var işte boğuluyorum,Turkish,0
cómo s narcisismo ahora marian les contó a ambos todo lo que había pasado y ella ha cambiado mucho desde ese momento,Spanish,0
 cambios de este tipo pueden ser detectados con la utilización de una herramienta llamada wikiscanner,Spanish,0
roy rosenzweig a history professor stated that american national biography online outperformed wikipedia in terms of its clear and engaging prose which he said was an important aspect of good historical writing,English,0
wenn sie jemanden bitten nicht verärgert zu sein nicht zu weinen können sie sagen nehmen sie es sich nicht zu herzen,German,0
10 января 2006 года знаку был предоставлен зарегистрированный статус,Russian,0
ركضت لتعانق والدتها التي كانت جالسة في المنزل حزينة ولا أخت يا ابنتي الحلوة اعتقدت أنني لن أراك مرة أخرى,Arabic,0
en 2016 un système dintelligence artificielle à base dapprentissage automatique nommé lipnet parvient à lire sur les lèvres avec un grand taux de succès,French,0
wikipedia wordt bewerkt door vrijwilligers en heeft een open structuur,Dutch,0
 some such as e o wilson of harvard university predict that human destruction of the biosphere could cause the extinction of onehalf of all species in the next 100 years,English,0
ihre freunde das ist dieser großartige kanal für studenten und einige andere wörter die sie anstelle von großartig verwenden können sind unglaublich fantastisch oder außergewöhnlich gut,German,0
ett innehållsdrivet meritsystem riskerar att bidragsgivare av rädsla för att sänka sin meritstatus försöker förhindra att deras text ändras,Sweedish,0
has she i guess she wouldnt want any more gold bread now huh you know,English,0
ഇതലട കമപയടടറകള നരടടളള നർദദശങങൾ വഴയലലത ഉദഹരണങങൾ മതര ഉപയഗചച പരശലപപകകകയ അത വഴ തരമനങങളലതതൻ പരപതയകകകയ ചയയനന,Malayalam,0
شكرا على مجهودك,Arabic,0
no entanto uma pesquisa realizada pelo oxford internet institute mostrou que a distribuição geográfica dos artigos de todas as versões da wikipédia é muito desigual,Portugeese,0
 esta última afirmación fue desmentida por jimmy wales fundador de wikipedia,Spanish,0
ചവടവപപ യനതരപഠന കതരമ ബദധയട ഒര പരമഖ വശമണ,Malayalam,0
لذلك سوف نتعلم اليوم 10 كلمات ذكية جديدة معانيها  كلمات جذرية وجمل أمثلة لذلك دعونا نبدأ كل من هذا وأنتم تشاهدون,Arabic,0
att använda ordet catch22,Sweedish,0
 for example the rule       o n i o n s  p o t a t o e s      b u r g e r     displaystyle mathrm onionspotatoes rightarrow mathrm burger    found in the sales data of a supermarket would indicate that if a customer buys onions and potatoes together they are likely to also buy hamburger meat,English,0
ഞൻ നങങൾകക ഒര വടടലകക പകൻ ആഗരഹകകനനണട,Malayalam,0
كما تم إنشاء إصدارات اللغة بإجمالي 161 طبعة بنهاية عام 2004,Arabic,0
ill be right with you,English,0
എനകക അതനകകറചച ഉറപപലല,Malayalam,0
a claim that is likely to be challenged requires a reference to a reliable source,English,0
да пожалуйста,Russian,0
لاستخدام كلمة catch22,Arabic,0
ik red het wel,Dutch,0
välmodig ordet suave har flera olika ursprung men ett mycket intressant ursprung till ordet är vilket betyder trevlig eller söt smakprov,Sweedish,0
vous pouvez également préciser les sections à actualiser en utilisant section à actualiser,French,0
я голодаю могу ли я съесть чтонибудь из этой вкусной еды конечно здесь мясо вонючая мелисса она принесет тебе все что ты хочешь я так много слышал о тебе ты бедный дорогой ты голоден я принесу тебе немного еды о спасибо они пошли в столовую и там на столе была самая поразительная еда которую нарциса когдалибо видела удивительной потому что это варенье,Russian,0
på wikidata kan även siffror namn och annan kvantitativ data motsats till löpande text lagras gemensamt för alla språkversioner,Sweedish,0
het dominante profiel van de bewerkers heeft  algemeen gesproken  gevolgen voor het soort en aantal artikelen en daarnaast ook voor de inhoud van artikelen wat dale hoiberg voormalig hoofdredacteur van de encyclopædia britannica een systematische fout of bias noemt,Dutch,0
eller när affärer har varit tröga i det här kvartalet kan du använda det i ditt dagliga liv om du känner dig väldigt trött en dag kan du berätta för din mamma eller berätta,Sweedish,0
there is no discrete boundary between earths atmosphere and space as the atmosphere gradually attenuates with increasing altitude,English,0
vikipedi çevrimiçi olarak ve katı olmayan bir lisans ile sunulmaktadır,Turkish,0
zo was bijvoorbeeld het artikel over de stripfiguren casper en hobbes op de engelstalige wikipedia een tijdlang uitgebreider dan dat over william shakespeare,Dutch,0
ξέρετε αν κάποιος λέει ένα αστείο αστείο μπορείτε να πείτε ότι είναι καλό,Greek,0
le 26 janvier 2007  wikipédia  a aussi été nommée quatrième meilleure marque par les lecteurs de brandchannel recevant 15  des voix en réponse à la question  quelle marque a le plus dimpact sur nos vies en 2006 ,French,0
åsikter,Sweedish,0
hesitating,English,0
 em abril de 2011 a wikipédia foi listada como o quinto site mais popular do mundo pela google inc fundação  final de 2001 6 de dezembro de 2001  2003 13 de outubro de 2003  13 de maio de 2010 logo atual afastandose do estilo das enciclopédias tradicionais a wikipédia emprega um sistema aberto um modelo de edição wiki,Portugeese,0
no tengo la libertad de decirlo,Spanish,0
fammi pensare un momento,Italian,1
ಹಗದರ ಧನಯವದಗಳ ಅದ ಅಪರಸತತವಗತತದ ಆದರ ಹಗದರ ಧನಯವದಗಳ,Kannada,0
när du hör en mening öva det efter mig,Sweedish,0
este tipo de aprendizaje usa un árbol de decisiones como modelo predictivo,Spanish,0
ಯವದ ಸಮಯದಲಲ,Kannada,0
ഓൺലൻ തരയലലട റഫറൻസകൾ കണടതതക എനനത മലയളഭഷയൽ ബദധമടടണനനകരയ ഏവർകകമറവളളതണലല,Malayalam,0
شخص ما مشغول  يمكنك دائما أن تقول آسف لإزعاجك ثم يمكنك المضي قدما والسؤال,Arabic,0
nécessaire,French,0
je nécoutais pas une autre phrase que jutilise tout le temps,French,0
 مقال للتخريب في كثير من الأحيان يمكن أن تكون شبه محمية أو محمية بشكل كامل وهذا يعني أنه ليس هناك سوى مستويات صلاحيات معينة حتى تستطيع تعديله,Arabic,0
there are a number of such regions ranging from the tropical climate at the equator to the polar climate in the northern and southern extremes,English,0
incluso los que la defienden como una obra documentada caso de tim oreilly la colocan en los últimos puestos,Spanish,0
 the question to what is the difference between ml and ai is answered by judea pearl in the book of why,English,0
നങങൾകക എങങനയണട,Malayalam,0
لا يمكنك الشكوى من العبارة التالية يخبرك شخص ما بشيء ما ولم تذكره حقا في المحادثة كما يظنون بطريقة ما أن لديك وظيفة جديدة  وأنت تسأله,Arabic,0
hanno fatto seguito altri wikireader preparati nel formato pdf o con le versioni stampate in preparazione per la vendita,Italian,1
okej låt oss börja,Sweedish,0
kaynak belirtilmeli verilen bilgiler bazen onaylanmamış ve sorgulanabilir olabilir kaynakları eksik olabilir,Turkish,0
gemenskapen poängterar att administratörerna inte skall tillmätas större auktoritet i sak utan endast stödja själva processen,Sweedish,0
από πού πήρατε τις ειδήσεις όπως εσείς,Greek,0
het is niets,Dutch,0
 their reproduction is both rapid and profuse,English,0
 atualmente a extensão lucene 21 é escrita em java e baseada na lucene library 23,Portugeese,0
maybe you were talking on the phone and somebody was talking to you and youre like,English,0
aidezmoi à faire cuire le pain hein pas question maman les servantes de farine tous mes yeux brillants et brillants,French,0
ik ga je de 50 beste engelse zinnen geven die je in je dagelijks leven kunt gebruiken,Dutch,0
qué hay de tí,Spanish,0
jai foiré je lai foiré si vous voulez que quelquun travaille à ma place vous pouvez dire,French,0
в апреле 2007 года проектом pew internet  american life project было установлено что треть американских интернетпользователей консультируются с википедией,Russian,0
это простая задача означает что это действительно простое решение для вас если вы сделали чтото не так и признаете это вы можете сказать что я облажался да ребята,Russian,0
artikelförfattarna menar att wikipedias nätgemenskap främjas av det svåra arbetet att söka konsensus och att sådant arbete kanske är det största formuleringsarbetet i wikipedia och motsätter sig andra forskares åsikt att dessa aspekter av samarbetet är kostsamt och improduktivt,Sweedish,0
i frankrike användes tidigare möte av armén för att ange en mötesplats för trupperna nu finns det något lite spännande och hemlighetsfullt om ordet möte även nu så medan du kan använda möte för alla möten,Sweedish,0
mijn lieve kind je bent zo mooi en lief maar je geeft niks anders dan je schoonheid,Dutch,0
bien que les effets économiques du ba soient relativement limités aujourdhui et que nous ne soyons pas confrontés à une  fin du travail  imminente comme cela est parfois proclamé les implications pour léconomie et la maindœuvre sont profondes ,French,0
ce but est atteint en 2011 quand watson gagne à jeopardy,French,0
 em 2005 a agence francepresse citou daniel brandt o proprietário do wikipedia watch dizendo que o problema básico é que ninguém nem os administradores da wikimedia foundation nem os voluntários que estão conectados com a wikipédia consideramse responsáveis pelo seu conteúdo,Portugeese,0
 su existencia fue oficialmente anunciada por el director general de bomis y cofundador de wikipedia jimbo wales el 20 de junio de 2003,Spanish,0
per garantire tale progresso wikipedia si fonda su cinque pilastri sulle seguenti linee guida volte ad identificare quali tipi di informazioni siano adatte a esservi inserite e su un codice di comportamento detto wikiquette,Italian,1
multilinear subspace learning algorithms aim to learn lowdimensional representations directly from tensor representations for multidimensional data without reshaping them into higherdimensional vectors,English,0
അനക ഉപയകതകകൾ തങങളട കഴചചപപട അനസരചച ലഖന മററ എഴതമപൾ പലപപഴ ഒരൾ എഴതയ കരയങങൾ പതതയ എഴതനന ആൾ മയചചകളയറമണട,Malayalam,0
da han nysede åh åh og det sidste stop nej jeg vil ikke høre mere alt hvad jeg kunne se var at disse mænd var rigtig flinke min kære du skal vide den skønhed,Danish,0
las marcas han sido realizadas voluntaria y gratuitamente por usuarios de wikipedia y sus derechos pertenecen a la fundación wikimedia,Spanish,0
this is while wikipedia faces a more concerning problem than funding namely a flattening growth rate in the number of contributors to the website,English,0
per le pubblicazioni stampate gli editori devono garantire che i loro dati siano attendibili in quanto il loro sostentamento dipende da ciò,Italian,1
er is geen ruimte voor twijfel in amerika of je iemand wilt smsen of ze een bericht wilt sturen zeg je tekst naar tekst dus ik stuur je een sms betekent dat ik je een bericht zal sturen via whatsapp of een telegram of een boodschapper van wat dan ook ik zal sms je nog een keer om iemand op te vrolijken en te zeggen dat ze niet boos moeten zijn je kunt zeggen dat het het niet waard is zoals waarom huil je,Dutch,0
perdon por interrumpirte,Spanish,0
en 2012 un réseau neuronal développé par google parvient à reconnaître des visages humains ainsi que des chats dans des vidéos youtube,French,0
tuttavia già dalla metà degli anni 50 lo studio dellintelligenza artificiale si stava concentrando su approcci logici di tipo knowledgebased nota oggi sotto il nome di gofai causando un distacco tra lo studio dellia e quello dellapprendimento automatico,Italian,1
ஒர கணம எனனடன தரஙகள,Tamil,0
ஸமரட சல எண 5 பரமதமனத பரமதமனத பரமதமனத ஆசசரயமன ஆசசரயம எனற பரள,Tamil,0
вандализм в википедии  явно вредительское добавление удаление или изменение содержания совершённое умышленно в целях скомпрометировать достоверность и авторитетность энциклопедии,Russian,0
regression analysis encompasses a large variety of statistical methods to estimate the relationship between input variables and their associated features,English,0
var magiske væsener noget som narcisses mor ikke vidste noget om terry melli åh det er så godt at se dig det har været meget længe t det hvordan har du været jeg har været meget god jeg ville have været bedre hvis kun hvis kun hvad hvis kun min datter narcisa var lidt mere forståelig marian fortalte mellie og terry alt om narcisa og hvordan hun var bekymret for hende hun vil spise brød lavet af guld hvad gør jeg godt med hende måske hvis hendes drøm går i opfyldelse,Danish,0
normalde bir eserin yazarı o yazının telif hakkını elinde bulundurur ve bu hak diğer insanların bu yazıyı değiştirmesini ve kopyalamasını engeller,Turkish,0
semisupervised learning falls between unsupervised learning without any labeled training data and supervised learning with completely labeled training data,English,0
wikipedias trovärdighet både jämfört med andra uppslagsverk och andra specialiserade källor kan analyseras på olika sätt bland annat genom blindtester av experter genom statistik genom analys av historiska mönster och genom att analysera styrkor och svagheter i wikimodellen,Sweedish,0
performing machine learning involves creating a model which is trained on some training data and then can process additional data to make predictions,English,0
ساعدني في خبز الخبز  هاه بأي حال من الأحوال أمي الخادمات الطحين كل عيني المشرقة والمتألقة,Arabic,0
zu meiner mutter lass mich nach hause gehen melissa und terrence sahen sich an und zwinkerten gut,German,0
دعني أفكر للحظة,Arabic,0
നങങള ആശചരയപപടതതനന എനതങകല ഉണടങകൽ ഓ എനറ ദവതതപപല നങങൾ എനന കളയകകണ എനന പറയ,Malayalam,0
at blive bedøvet så fantastisk bruges til at beskrive noget der er forbløffende godt for eksempel ser hun fantastisk ud i den kjole eller hvilken fantastisk udsigt fra denne altan eller jeg læser denne fantastiske bog som jeg ikke kan lægge fra hvad med dig at gå og fortælle,Danish,0
du måste äta allt detta jag trodde att du gillade snygga saker nej jag vill inte gifta mig med dig jag vill åka hem,Sweedish,0
lassen sie uns also in hoffentlich 10 minuten 50 sätze auf englisch schreiben,German,0
où avezvous les nouvelles comme comment allezvous,French,0
hoe gaat het,Dutch,0
sadece endişelenme diyebilirsin,Turkish,0
компьютерные программы называемые ботами в википедии широко используются для удаления вандализма как только он был произведён а также для исправления общих ошибок и стилистических проблем или создания статей например о географических объектах или биологических видах в стандартном формате из статистических данных,Russian,0
എലല മസവ തരഞഞടതത ലഖന ആകവൻ സമർപപകകപപടനന പല ലഖനങങൾ ഉണടവ,Malayalam,0
 en cualquier caso wikipedia como proyecto de fuente no primaria que es se basa en una serie de políticas que promueven la verificabilidad y el uso de fuentes fidedignas y reputadas,Spanish,0
for more advanced tasks it can be challenging for a human to manually create the needed algorithms,English,0
for example to train a system for the task of digital character recognition the mnist dataset of handwritten digits has often been used,English,0
så om du bara ska påbörja din resa,Sweedish,0
bir telefon görüşmesinde kullanmak için akıllı kelimeler arıyorsanız o zaman bir videoya bağlantı koyuyorum,Turkish,0
im energiebeispiel macht mich ein schweres mittagessen sehr nachmittags träge hat wurzeln aus dem wort was bedeutet dass eine langsame person und eine schnecke ein tier ist das sich wirklich sehr langsam bewegt wie ein schneckenbeispiel,German,0
ella corrió a abrazar a su madre que estaba sentada en la casa triste ni hermana o mi dulce hija pensé que nunca te volvería a ver,Spanish,0
eu o confundi então deixeme dar alguns exemplos,Portugeese,0
δεν είμαι ελεύθερος να πω,Greek,0
ce fut un plaisir de vous rencontrer plus tard,French,0
though the term has fallen into disfavor among botanists as a formal way to categorize useless plants the informal use of the word weeds to describe those plants that are deemed worthy of elimination is illustrative of the general tendency of people and societies to seek to alter or shape the course of nature,English,0
quiero continuar,Spanish,0
كيف أخبرتهم النرجسية الآن ماريان بكل ما حدث وتغيرت كثيرا منذ ذلك الوقت,Arabic,0
marian erzählte mellie und terry alles über narcisa und wie sie sich sorgen um sie machte die sie essen möchte brot aus gold was mache ich mit ihr gut vielleicht wenn ihr traum wahr wird,German,0
for the best performance in the context of generalization the complexity of the hypothesis should match the complexity of the function underlying the data,English,0
 mobila wikipediaappar används bara för en bråkdel av accesserna,Sweedish,0
ಸಮನಯವಗ ಆದರ ಅದ ಗದದದ  ಅಧಕತ ಸಭಗ ಇದ ತಬ ಸಕತವಗದ ಆದದರದ ನವ ದನಕವನನ ಹದದದರ ಬಹಶ ನವ ರಡಜವಸ ಸಮರಟ ಪದ ಸಖಯ 9 ಅನನ ಒಬಟಸ ಒಬಟಯಸ ಒಬಟಸ ಎದ ಕರಯಬಹದ ನವ ಯರನನದರ ಮಕ ಅಥವ ಬದಧಹನ ಎದ ಕರಯಲ ಪರಯತನಸವಗ ನವ ಅದನನ ಬಳಸತತರ,Kannada,0
frasi se stai imparando linglese da un po e vuoi riprendere lapprendimento,Italian,1
altın ekmek bir zamanlar küçücük bir köyde marion adında bir kadın yaşardı,Turkish,0
tale presupposto non è assolutamente dimostrato,Italian,1
അത ശരകക നങങൾകകവശയമണടങകൽ ഞൻ നങങള വടടലകക കണടപക ടറൻസ കരചചല അസനതഷടയ എടതത,Malayalam,0
 efter att wikipedias grundare larry sanger pekat ut vad han ansåg vara fall av barnpornografi i wikipedias bildbank wikimedia commons tog wikipedias andra grundare jimmy wales hastigt bort flera bilder med sexuellt innehåll inklusive sakligt material utan att konsultera användarna i stort,Sweedish,0
ആർകക എഴതവനന ഒര സവതനതരവജഞനകശ എനന ആശയ സവതനതര സഫററ വയറനറ പരണതവയ റചചർഡ സററൾമൻ 1999ൽ മനനടട വചചരനന,Malayalam,0
нет извини я уже помешал на некоторых планах,Russian,0
и острый угол  это острый угол менее 90 градусов такой острый как это слово используется для обозначения острого и следовательно также мысленно острого и тупого обозначает тупой и следовательно также немного медленный в уме поэтому примеры предложений с тупыми словами  это мужчина был настолько тупым что выдал свой пароль поддельному абоненту или тупому ребенку,Russian,0
இநத வரததயப பயனபடதத மலயல அஙகய இரககம அநத ஆடமபரமன பயன யர எனற சலல மறககதரகள உடனடயக உஙகள சறகளஞசயதத உரவககம,Tamil,0
in realtà sono le 1300 proprio adesso,Italian,1
jij rock je rock,Dutch,0
और बतओ कय ह रह ह,Hindi,0
undgår et spørgsmål,Danish,0
devam et,Turkish,0
yeah of course,English,0
quando ouvir uma frase pratique dizendo depois de mim,Portugeese,0
quiero recordarte que en caso de que estés buscando palabras inteligentes para usar en una llamada telefónica voy a poner un enlace a un video,Spanish,0
sikkert ikke noget problem,Danish,0
para mim embaixo dele me dizendo qual dessas 10 palavras qual é a sua favorita e também,Portugeese,0
sen nasılsın,Turkish,0
come va,Italian,1
with the ozone layer absorbing harmful ultraviolet radiation life colonized the surface of earth,English,0
ಆದದರದ ಒದ ಸಮಯದಲಲ ನವ ಉಚಚರಸತತದದರ ಎದ ಖಚತಪಡಸಕಳಳ,Kannada,0
me temo que no tengo ni idea,Spanish,0
en general pero ganó  no es muy apropiado para una reunión oficial por lo que si tiene una cita tal vez pueda decir que una palabra inteligente de cita número 9 es obtusa obtusa obtusa es un insulto que usaría cuando intenta llamar a alguien tonto o poco inteligente,Spanish,0
je suis désolé,French,0
nota 7 por razões legais o conteúdo na wikipédia está sujeito às leis lei de direitos autorais em particular da flórida onde os servidores da wikipédia estão hospedados,Portugeese,0
det är faktiskt kl,Sweedish,0
எனன மனனககவம,Tamil,0
spørger jeg og så siger jeg til sidst,Danish,0
some types of native flora actually have been introduced centuries ago by people migrating from one region or continent to another and become an integral part of the native or natural flora of the place to which they were introduced,English,0
ಹಗದರ ಧನಯವದಗಳ ಇಲಲ ಮತತ ನನ ವಯಕತಯನನ ಕಳದದದಗ ಕಲವಮಮ ನನನ ಇಮಲನಲಲ ಬಳಸವ ಇನನದ ನಡಗಟಟ,Kannada,0
ja du kan bara svara kan inte klaga allt är riktigt coolt,Sweedish,0
 shortly after the prize was awarded netflix realized that viewers ratings were not the best indicators of their viewing patterns everything is a recommendation and they changed their recommendation engine accordingly,English,0
además mediante las pestañas pueden navegar interaccionar o colaborar con otras páginas,Spanish,0
ich bin das ganze wochenende frei lass uns etwas tun,German,0
in het algemeen maar het won  het is erg geschikt voor een officiële vergadering dus als je een date hebt kun je misschien zeker noemen dat een rendezvous slim woord nummer 9 stomp is stomp stomp is een belediging die je zou gebruiken als je iemand dom of ongewild probeert te noemen of domme nu je het woord stomp hebt gehoord in geometrie stompe hoek en scherpe hoek dus een stompe hoek is een hoek groter dan 90 graden maar kleiner dan 180 graden,Dutch,0
fortsæt,Danish,0
