Text,Language,target
 op 15 januari 2016 de 15e verjaardag van wikipedia werd bekend dat er een fonds was opgericht de wikimedia endowment dat de komende 10 jaar 100 miljoen dollar moet gaan inzamelen teneinde het voortbestaan van wikipedia op de lange termijn te garanderen,Dutch,0
പറയപററ പനതരകല ഇബസൻ തടങങയ ലഖനങങൾ ഈ മസതത തരഞഞടതത ലഖനങങളവൻ സമർപപകകപപടടരകകനന,Malayalam,0
ಓ ಪರಯ ಒದ ರತರ ಅವಳ ಮಲಗದದಗ ತಯ ಅವಳನನ ನಡತತ ಕಳತಳ,Kannada,0
cette conception plus collective soppose à la conception française,French,0
അവളട ഏക മകളയ നർസസ മരയൻ വളര വനതവ മധരമളളതമയ നർസസ ആയരനന എനനരനനല അവൾ ഒര ജവനളളവളയരനനവനന വകകകൾകകപപറതത സനദരയണനന നങങൾ കണനന,Malayalam,0
in quanto enciclopedia a carattere universale o generalista wikipedia tratta voci di molti argomenti diversi,Italian,1
в 2003 году в исследовании о википедии как о сообществе студент  andrea ciffolilli утверждал что низкие операционные затраты участия в вики создают катализатор для совместного развития и что подход творческого развития поощряет участие,Russian,0
basic greetings hows it going,English,0
ich persönlich liebe den satz den du rockst was bedeutet dass du unglaublich bist,German,0
feature learning algorithms also called representation learning algorithms often attempt to preserve the information in their input but also transform it in a way that makes it useful often as a preprocessing step before performing classification or predictions,English,0
и я всегда так делаю вы можете сказать скрестив пальцы и вы скрестите пальцы вот так,Russian,0
ciò ha portato alla decisione di restringere  nelledizione di wikipedia in inglese  la possibilità di creare nuove voci ai soli utenti registrati,Italian,1
nasılsın gibi haberleri nereden aldın,Turkish,0
προτάσεις,Greek,0
vielen dank,German,0
 about 50 percent of search engine traffic to wikipedia comes from google a good portion of which is related to academic research,English,0
a 2008 study conducted by researchers at carnegie mellon university and palo alto research center gave a distribution of topics as well as growth from july 2006 to january 2008 in each field these numbers refer only to the number of articles it is possible for one topic to contain a large number of short articles and another to contain a small number of large ones,English,0
в классических задачах аппроксимации объектами являются действительные числа или векторы,Russian,0
det skulle vara underbart skulle det inte vara bra oavsett jag antar att med tiden kommer hon att lära sig låt oss prata om något annat,Sweedish,0
trataron de resolver el problema con diversos métodos simbólicos así como lo que ellos llamaron redes neurales que eran en general perceptrones y otros modelos básicamente basados en modelos lineares generalizados como se conocen en las estadísticas,Spanish,0
что означает что побуждает человека повторить еще раз,Russian,0
 the origin of life on earth is not well understood but it is known to have occurred at least 35 billion years ago during the hadean or archean eons on a primordial earth that had a substantially different environment than is found at present,English,0
afin dassurer la pérennité des liens vers ces sources internet archive a réparé en 2018 près de 9 millions de liens brisés,French,0
studien inkluderar en fallstudie och ger en inblick i om hur snabbt en envis klottrares bidrag återställs och hur klottraren sedan blockeras,Sweedish,0
den danske wikipedia har 264512 artikler pr,Danish,0
 beck added that wikipedia has its own peer review process before articles can be classified as good or featured,English,0
dautres critiquent le fait que tout le monde peut modifier wikipédia comme dans un épisode de la série télévisée the office où michael scott déclare que  wikipédia est la meilleure chose de tous les temps,French,0
для измерения точности ответов вводится оценочный функционал качества,Russian,0
sumpf ist ein stück feuchtgebiet und wenn jemand an der falschen stelle auf einen sumpf tritt kann er leicht ertrinken und die verbform sumpf bedeutet zu sinken,German,0
pidiendo repetición,Spanish,0
diğer ansiklopedilerden farklı olarak vikipedi gnu özgür belgeleme lisansı göbl kullanmaktadır,Turkish,0
время от времени некоторые страны закрывают или угрожают закрыть доступ к википедии,Russian,0
sont disponibles sous diverses licencesf,French,0
ma aveva il cuore spezzato per tutto quello che cera immangiabile ha iniziato presto a piangere non lo voglio ma il cibo è davvero buono,Italian,1
jag är inte säker på att jag håller med,Sweedish,0
dat zou geweldig zijn bedankt,Dutch,0
comme nupedia fonctionne avec un comité scientifique la progression du nombre darticles est très lente,French,0
شهرة ويكيبيديا تنمو بثبات منذ بداية عملها,Arabic,0
uma situação complicada é quando você não consegue um emprego sem ter experiência de trabalho,Portugeese,0
je ne peux pas me plaindre de la phrase suivante quelquun vous dit quelque chose et vous ne lavez pas vraiment mentionné dans la conversation comme sil pensait que vous avez un nouvel emploi et vous lui demandez,French,0
maar je kunt pas ervaring opdoen als je een baan krijgt,Dutch,0
despite the name administrators are not supposed to enjoy any special privilege in decisionmaking instead their powers are mostly limited to making edits that have projectwide effects and thus are disallowed to ordinary editors and to implement restrictions intended to prevent certain persons from making disruptive edits such as vandalism,English,0
தறமல வககய வதத அநதக கறககள அடயச சயத தடடவடவம கடதத பரம சஙகரயச சரம,Tamil,0
autorizzazione,Italian,1
നങങൾകക കഷമകകണ എനന പറയൻ കഴയ,Malayalam,0
estes incluem páginas onde os usuários podem verificar edições por exemplo páginas vigiadas e mudanças recentes programas de computador bots que são cuidadosamente projetados para tentar detectar ataques e corrigilos automaticamente ou semiautomaticamente filtros que avisam os usuários sobre fazer indesejáveis edições bloqueios sobre a criação de links para sites em particular e bloqueios de edições de contas específicas endereços de ip ou intervalos de endereços,Portugeese,0
non merci de toute façon et une autre phrase que jutilise parfois dans mon email quand je nai pas demandé de personne,French,0
 sanger also expressed concerns about access to the images on wikipedia in schools,English,0
ದಯವಟಟ ನವ ಕಷಣ ಕಷಣ ಹಡದಡಬಹದ,Kannada,0
det er en god vittighed så sætningen er at det er en god en,Danish,0
exceto por algumas páginas particularmente propensas ao vandalismo cada artigo pode ser editado de forma anônima ou com uma conta de usuário,Portugeese,0
содержимое википедии подпадает под действие законов в частности авторского права штата вирджиния в сша где находятся серверы википедии и нескольких редакционных политик и руководств которые призваны укрепить идею о том что википедия является энциклопедией,Russian,0
لما كانت ويكيبيديا موسوعة متاحة عبر الويب فهي موسوعة عالمية وقد يستخدم المشاركون الذين يستخدمون نفس اللغة لهجات متباينة أو ربما يأتون من بلاد مختلفة هذه هي الحال في العديد من الويكيبيديات منها الويكيبيديا الإنجليزية والصينية هذا قد يؤدي إلى اختلافات في التهجئة أو في وجهات النظر,Arabic,0
ce qui a fait dire à maurice merleauponty  ce ne sont pas les découvertes scientifiques qui ont provoqué le changement de lidée de nature,French,0
algunas ediciones de wikipedia utilizan también bots para la creación masiva de artículos normalmente esbozos,Spanish,0
all dies wird bald vorbei sein als er sagte dass der wagen durch ein anderes portal fuhr und die auffahrt erreichte,German,0
позвольте мне немного подумать,Russian,0
 a 2011 study conducted by researchers at the university of minnesota indicated that male and female editors focus on different coverage topics,English,0
കലസറററഗ ഈ ഗണതതൽപപടനന,Malayalam,0
probeer mijn uitspraak exact te kopiëren inclusief de tone of voice die ik gebruik,Dutch,0
data som är gemensamma för många språkversioner behöver på så sätt bara uppdateras på ett ställe,Sweedish,0
outra forma de perguntar se você não entendeu parte de uma frase pode dizer que não entendi a última palavra,Portugeese,0
of a huge and magnificent golden castle narcisa was amazed at all the beauty she saw i knew i deserve so many riches i knew youd like it anything you want you will find here from the prettiest of dresses to the tastiest of foods all of it in my palace well speaking of food im really hungry after that ride im starving can i have any of that tasty food of course here meat smelly melissa she will get you whatever you want ive heard so much about you you poor dear youre hungry arent you come lets go to the dining table and ill get you some food oh thank you they went into the dining room and there on the table was the most astounding food narcisa had ever seen amazing thats because it is the jams are made,English,0
to use the word catch22,English,0
χτυπάτε το καρφί στο κεφάλι,Greek,0
pantano es un pedazo de pantano y si alguien pisa un pantano en el lugar equivocado podría ahogarse fácilmente y la forma verbal de pantano significa hundirse así que así es como puedes usar esta palabra,Spanish,0
 when contacted on this matter clay shirky associate professor at new york university and fellow at harvards berkman klein center for internet  society indicated that he suspected much of the page view decline was due to knowledge graphs stating if you can get your question answered from the search page you dont need to click any further,English,0
lawrence found the articles accurate but not very readable and thought that wikipedias lack of readability to noncollege readers may reflect its varied origins and haphazard editing,English,0
vragen naar informatie,Dutch,0
ಅದ ಅದಭತವಗದ ಧನಯವದಗಳ,Kannada,0
നങങളട കഫ എനനലടനള ഉപകഷചചൽ വഷമകകണടതലല എനനത പരശനമലല,Malayalam,0
attendez un instant,French,0
nature er et britisk multidisciplinært videnskabeligt tidsskrift der blev udgivet første gang den 4 november 1869,Danish,0
 அத ஒர தனபபடட ஆஙகல மழப பதபபக வககபபடயகம ,Tamil,0
le contenu encyclopédique se veut respectueux de la  neutralité de point de vue  définie par jimmy wales comme le fait de  décrire le débat plutôt que dy participer ,French,0
nécessaire et en ukrainien,French,0
sie fing bald an zu weinen,German,0
ಒದ ಬಹತ ಮತತ ಭವಯವದ ಗಲಡನ ಕಯಸಲ ನರಸಸ ಅವರ ನಡದ ಎಲಲ ಸದರಯವನನ ನಡ ಆಶಚರಯಚಕತರದರ ನನ ಅನಕ ಸಪತತಗ ಅರಹನದ ನನಗ ತಳದತತ ನಮಗ ಬಕದದನನ ನವ ಬಯಸತತರ ಎದ ನಮಗ ತಳದತತ ನವ ಬಯಸದ ಯವದನನದರ ನವ ಇಲಲ ಕಣಬಹದ ನನನ ಅರಮನಯಲಲ ಆಹರದ ಬಗಗ ಚನನಗ ಮತನಡತತ ನನ ಆ ಸವರಯ ನತರ ನಜವಗಯ ಹಸದದದನ,Kannada,0
hun løb for at kramme sin mor der sad trist i huset heller ikke søster min søde datter jeg troede jeg ville aldrig se dig igen,Danish,0
ποιες είναι οι απόψεις σας σχετικά με αυτό νομίζω ότι είναι καλή ιδέα,Greek,0
в ноябре 2015 года википедия получила премию эразма,Russian,0
la denuncia de diversos errores e inconsistencias en los símbolos incluidos en el globorompecabezas y la posibilidad de diseñar una imagen animada o fotorrealista impulsó entre diversos editores de wikipedia un debate sobre la posibilidad de realizar modificaciones en el elemento gráfico,Spanish,0
ಇದ ನನನ ತಪಪ,Kannada,0
una computazione è considerata fattibile se può essere svolta in tempo polinomiale,Italian,1
tu rock you rock,Spanish,0
estas diferenças podem levar a alguns conflitos sobre diferenças de grafia por exemplo trem ou comboio goleiro ou guardaredes ou pontos de vista,Portugeese,0
αυτό θα ήταν υπέροχο δεν θα είχε σημασία αν υποθέτω ότι θα μεγαλώσει για να μάθει ας μιλήσουμε για κάτι άλλο,Greek,0
krypteringen gör det dessutom mycket svårt att övervaka vem som läser vilken wikipediaartikel,Sweedish,0
og du forstod ikke hvad den anden person sagde du kan sige du sagde og med et spørgsmålstegn,Danish,0
так что это отличный способ попрактиковаться в том где мы снова были если вы в процессе разговора,Russian,0
esta aplicación es libre gratuita y solo funciona en el iphone 3g o en versiones más recientes,Spanish,0
எலலம பகறதனறல அவறற வளரபபதறக மனப நஙகள எனன சயதரகள,Tamil,0
il ny a aucun système hiérarchique de validation  aussi lencyclopédie estelle lobjet de nombreuses incompréhensions et critiques quant à la qualité et à la fiabilité de son contenu et lobjet détudes sur la fiabilité de wikipédia en anglais la langue la plus développée,French,0
jag kan inte tacka dig nog,Sweedish,0
potete coprirmi è ora di andare e ragazzi è meglio che vada il che significa che dovrei già andare,Italian,1
existe una jerarquía por la que ciertos editores son elegidos para tener mayor control editorial de los miembros de la comunidad,Spanish,0
scusa non stavo ascoltando,Italian,1
cependant de nombreuses images celles dont le statut visàvis du droit dauteur varie selon les pays ou celles qui sont protégées par des copyrights incompatibles avec un téléversement sous licence ouverte ny sont pas acceptées,French,0
en del projekt såsom finsk och engelskspråkiga wikipedia har dessutom egna filer som inte kan användas i andra projekt medan innehåll på commons förutsätts vara fritt tillåts i dessa projekt även proprietär media på basen av fair use återgivningsrätt,Sweedish,0
in july 2002 phase iii wikipedia shifted to the thirdgeneration software mediawiki originally written by lee daniel crocker,English,0
ich kann dir nicht genug danken,German,0
 tra il 28 dicembre 2005 e il 10 gennaio 2006 ledizione in lingua italiana di wikipedia è stata sottoposta a un esperimento da parte del settimanale lespresso che ha inserito volutamente quattro errori in altrettante voci dellenciclopedia álvaro recoba ugo foscolo giovanni spadolini georg hegel e una voce del tutto inventata su un inesistente poeta di nome carlo zamolli,Italian,1
நளகக ஏதனம தடடஙகள கடககம,Tamil,0
pläne schmieden,German,0
si alguien consiguió el trabajo de sus sueños o lo que sea que pueda decir afortunado o alguien entró en la universidad de sus sueños como afortunado esta es una forma de felicitar a la persona afortunada o simplemente enfatizar que tiene suerte,Spanish,0
από ρουμπίνια οι σαλάτες από σμαράγδια και το ψωμί εκεί είναι φτιαγμένο από χρυσό χρυσό ψωμί πόσο υπέροχη θα φαίνεται αυτή η μαρμελάδα και θα έχει υπέροχη γεύση με το ψωμί που πήρε μια φέτα με το,Greek,0
üzgünüm şu anda yapamam,Turkish,0
 a wikipédia também foi indicada para melhores práticas do webby,Portugeese,0
tom m mitchell ha fornito la definizione più citata di apprendimento automatico nel suo libro machine learning si dice che un programma apprende dallesperienza e con riferimento a alcune classi di compiti t e con misurazione della performance p se le sue performance nel compito t come misurato da p migliorano con lesperienza e in poche parole si potrebbe semplificare dicendo che un programma apprende se cè un miglioramento delle prestazioni dopo un compito svolto,Italian,1
latteggiamento dellaccademico medio verso il principale strumento di consultazione della nostra epoca e in particolare dei nostri studenti conferma conclusioni cui eravamo già arrivati,Italian,1
hey kalmeer jezelf samen een andere zin dat,Dutch,0
kann das immer sagen weil ich es nicht hatte ich habe mich sehr gut auf die prüfung vorbereitet,German,0
wikipedia wordt gepubliceerd onder een vrije licentie waardoor de inhoud elders opnieuw te gebruiken is,Dutch,0
det är en bra fråga,Sweedish,0
hayır harika bir iş çıkardın,Turkish,0
хотя некоторые участники сильны в своей области википедия требует чтобы даже их вклады были подкреплены опубликованными и поддающимися проверке источниками,Russian,0
ಯರದರ ನವ ಅವರ ಅದಷಟದ ಕನಸಗಳ ಕಲಸವನನ ಪಡದರ ನವ ಅದಷಟವತರ ಅಥವ ಯರದರ ಅವರ ಕನಸಗಳ ವಶವವದಯನಲಯಕಕ ನವ ಅದಷಟವತರ ಎದ ಹಳದರ ಇದ ನಮಗ ಅದಷಟವತ ವಯಕತಯನನ ಅಭನದಸವ ಒದ ಮರಗವಗದ ಅಥವ ಅವನ ಅದಷಟಶಲ ಎದ ಹಳಲ ಇನನದ ಮರಗವಗದ ನವ ನಜವಗಯ ಕಪಗಡದದರ ಎದರ ನನ ತಬ ಕಪಗಡದದನ ಎದ ನನ ಹಳದದನ ಇದ ತಬ ಕಪಗಡದ,Kannada,0
till ett engelsktalande land kan du helt använda det här,Sweedish,0
ja graag,Dutch,0
وضع خطط,Arabic,0
ma chère enfant tu es si belle et adorable mais tu ne te soucies de rien dautre que de ta beauté,French,0
this is a nobrainer means its a really easy decision for you if youve done something wrong and you admit it you can say i screwed up yes guys,English,0
അതകണടതനന എലലവർകക ഒര പല യജകകനവനന ഒര മധയമർഗതതന വകകയല ലഖനങങളൽ നലനൽപപണടവ,Malayalam,0
 under this system new and unregistered users edits to certain controversial or vandalismprone articles are reviewed by established users before they are published,English,0
म सच रह थ क कय य मर मदद कर सकत ह बलकल कई परशन नह ह बलकल मझ मदद करन म खश हग कषम कर म अभ नह कर सकत मझ डर ह क म नह कर सकत परसतव बनन कय म आपक एक गलस पन पल सकत ह,Hindi,0
le parisien rapporte que  seuls 56 des 309 députés élus den marche ,French,0
bij voorbaat dank wat betekent dat ik echt hoop dat je het gaat doen,Dutch,0
latteggiamento del mondo scientifico verso wikimedia come strumento di consultazione non è stato solo negativo,Italian,1
for derakhshan wikipedias goal as an encyclopedia represents the age of enlightenment tradition of rationality triumphing over emotions a trend which he considers endangered due to the gradual shift from a typographic culture to a photographic one which in turn means a shift from rationality to emotions exposition to entertainment,English,0
 a representative book of the machine learning research during the 1960s was the nilssons book on learning machines dealing mostly with machine learning for pattern classification,English,0
 um estudo de 2008 revelou que usuários da wikipédia eram menos agradáveis e abertos embora mais conscientes que os nãousuários da wikipédia,Portugeese,0
لقد أربكتك  لذا اسمح لي أن أقدم لك بعض الأمثلة على أن حالة الالتقاط هي عندما لا تحصل على وظيفة دون أن يكون لديك خبرة في العمل,Arabic,0
यह इसक लयक नह ह आप उस समसय स बहत बहतर ह जसक बर म आप र रह ह  अपन आसओ क लयक नह ह यह इस लयक नह ह क म वयकतगत रप स आपक पसद कए जन वल वकयश स पयर करत ह जसक अरथ ह क आप अदभत ह बप र बप तम चटटन तम चटटन,Hindi,0
nein ich will dich nicht heiraten,German,0
لكن حزن القلب بسبب كل ما كان هناك غير صالح للأكل  سرعان ما بدأت في البكاء لا أريد هذا ولكن الطعام جيد حقا,Arabic,0
أعتقد أنك مخطئ,Arabic,0
в этом видео я дам вам 100 общих и очень полезных предложений которые вы можете использовать в разговоре,Russian,0
നങങൾകക ആരടങകല നനദ പറയൻ തൽപപരയമണടങകൽ നങങൾകക ഇത വളര ദയനയമണനന പറയൻ കഴയ അത നങങൾകക വളര നനദയണട അത നങങളട വളര ദയലവണ,Malayalam,0
я дам вам 50 лучших английских фраз которые можно использовать в повседневной жизни,Russian,0
the authors focused on behavioral changes of the encyclopedias administrators after assuming the post writing that systematic bias occurred after the fact,English,0
jusquà ce que le conseil dadministration en vienne à suspendre un administrateur pendant un an et ce à lencontre de la tradition de la communauté qui règle généralement ses problèmes de manière collégiale,French,0
how do you know,English,0
а затем продолжайте и объясните где вы попали я правильно понял ,Russian,0
умное слово номер 7  это беспорядок,Russian,0
gå videre,Danish,0
 on august 23 2013 the new yorker website published a cartoon with this caption dammit manning have you considered the pronoun war that this is going to start on your wikipedia page,English,0
 interest related to pattern recognition continued into the 1970s as described by duda and hart in 1973,English,0
وبالمثل فإن العديد من هذه الجامعات بما في ذلك ييل وبراون أعطت ائتمانا جامعيا للطلاب الذين قاموا بإنشاء أو تحرير مقالة تتعلق بالنساء في العلوم أو التكنولوجيا,Arabic,0
அவர எனன தரமணம சயத களள வரமபவதகக கறனர அவர ஒர தஙக வணடயல வநதரநதர அவர மலரநத கழகவம தஙகமகவம அணநதரநதர எனன ஒர வடககயன கனவ,Tamil,0
de esta manera las redes neurales se adaptan a un impulso y son capaces de aprender,Spanish,0
non importa se vuoi augurare buona fortuna a qualcuno,Italian,1
നങങൾകക എനകക ഉപപ തരമ,Malayalam,0
und ich mache immer das man sagen kann daumen drücken und man drückt die finger so,German,0
படயனரககன சநதபப இடததக கறகக இரணவததல மநதய சநதபப பயனபடததபபடடத இபபத ரணடஸவஸ எனற வரததயப பறற சறற உறசகமன மறறம ரகசயமன ஒனற இரககறத எனவ இபபத நஙகள எநத சநதபபறகம சநதபபப பயனபடததலம,Tamil,0
δεν μπορώ να το πιστέψω ότι πρέπει να μου αστειεύεσαι για να πεις σε κάποιον να χαμογελάσει και να είσαι ευτυχισμένος μπορείς πάντα να πεις να πανηγυρίζεις,Greek,0
அழதபட வரததபபட வணடம எனற நஙகள யரயவத கடடல அத மனதல களள வணடம எனற சலலலம,Tamil,0
kesinlikle haklısın,Turkish,0
nej tack ändå och en annan fras som jag använder i min epost ibland när jag inte har bett om någon person,Sweedish,0
sim por favor,Portugeese,0
 a internet watch foundation uma organização não governamental sem fins lucrativos criticou a inclusão da fotografia como de mau gosto,Portugeese,0
gli algoritmi genetici sono stati applicati con successo a una varietà di compiti di apprendimento e di altri problemi di ottimizzazione,Italian,1
